{
  "$schema": "http://json-schema.org/draft-07/schema#",
  "title": "auto-mitamae orchestrator hosts.json",
  "description": "Fleet host registry consumed by orchestrator.sh (Phase 2b). Each entry carries connection info plus an optional ct_id (Phase B-2) used by the lazy credential re-seed step.",
  "type": "array",
  "minItems": 1,
  "items": {
    "type": "object",
    "required": ["host", "user", "role", "label"],
    "additionalProperties": false,
    "properties": {
      "host": {
        "type": "string",
        "pattern": "^([0-9]{1,3}\\.){3}[0-9]{1,3}$",
        "description": "IPv4 address — orchestrator SSHes to this directly (no DNS lookup at apply time)"
      },
      "user": {
        "type": "string",
        "pattern": "^[a-z][a-z0-9_-]*$",
        "description": "SSH login user (typically root for LXCs)"
      },
      "role": {
        "type": "string",
        "pattern": "^[a-z][a-z0-9/_.-]*\\.rb$",
        "description": "mitamae role file path, e.g. pve/lxc-monitoring.rb"
      },
      "label": {
        "type": "string",
        "pattern": "^[a-z][a-z0-9-]*$",
        "description": "Prometheus metric label and Grafana panel grouping key — must match contracts/devices.json device key"
      },
      "ct_id": {
        "type": ["integer", "null"],
        "minimum": 100,
        "maximum": 999,
        "description": "Phase B-2: PVE LXC container ID. Set for LXC hosts (orchestrator's ensure_creds step calls bootstrap-lxc-creds <ct_id> on auth failure). Set to null for bare-metal / EC2 hosts where the credential re-seed step is skipped."
      }
    }
  }
}
